{
  "$schema": "schemas/project-map.schema.json",
  "kind": "project-map",
  "version": "2.1.0",
  "updated": "2026-08-05",
  "status": "governance-sidecar",
  "project": {
    "name": "MT3",
    "type": "2D MMORPG 商业游戏",
    "primary_clients": [
      "Win32",
      "Android",
      "iOS"
    ],
    "server": "Java + Ant + gnet/xbean",
    "rendering_stack": [
      "Cocos2d-x 3.0-oh (Win32)",
      "Cocos2d-x 2.2.6 (Android/iOS)",
      "Nuclear",
      "CEGUI"
    ],
    "scale_notes": {
      "cpp_lines_estimate": 66000,
      "lua_lines_estimate": 355000,
      "java_lines_estimate": 1845000,
      "tools_lines_estimate": 2841000
    }
  },
  "authority_order": [
    "工程实际文件、日志、调用链、构建输出、已验证脚本与产物状态",
    "AGENTS.md",
    "就近 AGENTS.md / AGENTS.override.md",
    ".claude/RULES.md",
    ".claude/BUILD_GUIDE.md",
    ".codex/config.toml 与 .codex/agents/*.toml",
    ".agents/skills/mt3-project-guidelines/SKILL.md 及命中的最小技能集合",
    "本 project-map.json 与 workflow-engine.json sidecar"
  ],
  "runtime_architecture": [
    {
      "layer": "platform",
      "name": "平台层",
      "paths": [
        "client/MT3Win32App",
        "client/android",
        "client/FireClient/FireClient.xcodeproj",
        "client/FireClient/FireClient/iPhone",
        "client/FireClient/FireClient/main.m",
        "client/FireClient/FireClient/FireClientAppDelegate.mm",
        "client/FireClient/Application/platform/ios"
      ],
      "responsibilities": [
        "进程入口",
        "平台生命周期",
        "JNI/ObjC++/Win32 桥接",
        "SDK 与渠道接入"
      ]
    },
    {
      "layer": "cocos2d_x",
      "name": "分平台 Cocos2d-x 基础层",
      "paths": [
        "cocos2d-x-3.0-oh",
        "cocos2d-x-2.2.6"
      ],
      "responsibilities": [
        "图形基础",
        "音频",
        "平台抽象",
        "资源访问底座"
      ]
    },
    {
      "layer": "nuclear_engine",
      "name": "Nuclear 引擎层",
      "paths": [
        "engine"
      ],
      "responsibilities": [
        "场景",
        "精灵",
        "动画",
        "特效",
        "渲染组织"
      ]
    },
    {
      "layer": "fireclient",
      "name": "FireClient 业务层",
      "paths": [
        "client/FireClient",
        "client/resource/res/script",
        "client/resource/res/ui"
      ],
      "responsibilities": [
        "网络",
        "登录与入世界",
        "UI",
        "Lua 脚本",
        "配置与核心业务逻辑"
      ]
    }
  ],
  "task_domains": [
    {
      "id": "application-core-flow",
      "name": "应用核心层",
      "primary_paths": [
        "client/FireClient/Application"
      ],
      "skill": "application-core-flow",
      "agent": "mt3_runtime_troubleshooter",
      "boundary": "gRunGameApplication() 之后的共享 C++ 应用主链",
      "workflow_ids": [
        "application-core-flow",
        "runtime-crash"
      ]
    },
    {
      "id": "platform-bridge",
      "name": "平台抽象层",
      "primary_paths": [
        "client/MT3Win32App",
        "client/android",
        "client/FireClient/FireClient.xcodeproj",
        "client/FireClient/FireClient/iPhone",
        "client/FireClient/FireClient/main.m",
        "client/FireClient/FireClient/FireClientAppDelegate.mm",
        "client/FireClient/Application/platform/ios"
      ],
      "skill": "platform-bridge",
      "agent": "mt3_runtime_troubleshooter",
      "boundary": "平台入口、生命周期、JNI/ObjC++/Win32 壳层与渠道桥接",
      "workflow_ids": [
        "win32-build",
        "android-build",
        "ios-platform"
      ]
    },
    {
      "id": "rendering-pipeline",
      "name": "渲染处理层",
      "primary_paths": [
        "engine",
        "cocos2d-x-3.0-oh",
        "cocos2d-x-2.2.6",
        "tools/CEGUI-0.7.9-r5",
        "client/resource/res/ui"
      ],
      "skill": "rendering-pipeline",
      "agent": "mt3_runtime_troubleshooter",
      "supporting_agents": [
        "mt3_performance_analyst"
      ],
      "boundary": "CEGUI、Cocos2d-x、Nuclear、特效与显示异常",
      "workflow_ids": [
        "cegui-layout-integration",
        "cocos-cegui-shadow-migration",
        "runtime-crash"
      ]
    },
    {
      "id": "resource-packaging-pipeline",
      "name": "资源打包层",
      "primary_paths": [
        "client/resource",
        "tools"
      ],
      "skill": "resource-packaging-pipeline",
      "agent": "mt3_resource_pipeline_expert",
      "boundary": "PFS、热更新、版本索引、补丁发布与下载校验",
      "workflow_ids": [
        "resource-packaging"
      ]
    },
    {
      "id": "resource-name-path-recovery",
      "name": "资源名称与路径恢复层",
      "primary_paths": [
        "dependencies/SuperLJFilePackUnpack",
        "client/resource"
      ],
      "skill": "resource-name-path-recovery",
      "agent": "mt3_resource_pipeline_expert",
      "boundary": "解包后数字残留、扩展修正、候选分级、review/unresolved 收敛与受控回流",
      "workflow_ids": [
        "resource-name-path-recovery"
      ]
    },
    {
      "id": "sprite-pack-algorithm",
      "name": "打包算法层",
      "primary_paths": [
        "tools",
        "client/resource"
      ],
      "skill": "sprite-pack-algorithm",
      "agent": "mt3_resource_pipeline_expert",
      "boundary": "SpriteEditor、pack.ini、矩形打包、ANI/XAP 输出",
      "workflow_ids": [
        "sprite-pack-algorithm"
      ]
    },
    {
      "id": "server-protocol",
      "name": "服务端与协议层",
      "primary_paths": [
        "server",
        "common"
      ],
      "skill": "server-ant-build",
      "agent": "mt3_server_protocol_expert",
      "boundary": "Java Ant、gnet、xbean、rpc、生成代码与客户端协议同步",
      "workflow_ids": [
        "server-ant-build"
      ]
    },
    {
      "id": "codex-governance",
      "name": "代理配置治理层",
      "primary_paths": [
        ".codex",
        ".agents",
        ".claude"
      ],
      "skill": "codex-runtime-governance",
      "agent": "mt3_codex_governor",
      "boundary": "Codex runtime config、MCP、rules、requirements sidecar、subagent 与 repo-local skills",
      "workflow_ids": [
        "codex-governance"
      ]
    },
    {
      "id": "lua-ui",
      "name": "Lua UI 集成层",
      "primary_paths": [
        "client/resource/res/script",
        "client/resource/res/ui"
      ],
      "skill": "lua-dialog-integration",
      "agent": "mt3_lua_ui_integrator",
      "workflow_ids": [
        "lua-ui-integration"
      ],
      "boundary": "Lua Dialog 生命周期、事件绑定、窗口路径与 CEGUI 布局协同"
    }
  ],
  "directories": [
    {
      "path": "client/MT3Win32App",
      "role": "Win32 启动层/壳层",
      "modifiable": true,
      "encoding_note": "历史混合编码，修改前必须探测 BOM/换行",
      "modification_policy": "first-party-editable",
      "availability": "tracked_required"
    },
    {
      "path": "client/FireClient/Application",
      "role": "第一方 C++ 业务主链",
      "modifiable": true,
      "build_impact": "通常至少重编 FireClient -> MT3",
      "modification_policy": "first-party-editable",
      "availability": "tracked_required"
    },
    {
      "path": "client/resource/res/script",
      "role": "Lua UI 与业务脚本",
      "modifiable": true,
      "skill": "lua-dialog-integration",
      "modification_policy": "first-party-editable",
      "availability": "tracked_required"
    },
    {
      "path": "client/resource/res/ui",
      "role": "CEGUI layout/scheme/imageset/looknfeel",
      "modifiable": true,
      "skill": "cegui-layout-integration",
      "modification_policy": "first-party-editable",
      "availability": "runtime_workspace_local"
    },
    {
      "path": "client/android",
      "role": "Android 壳层与渠道工程",
      "modifiable": true,
      "toolchain": "NDK r16 clang + Ant + JDK8",
      "modification_policy": "first-party-editable",
      "availability": "tracked_required"
    },
    {
      "path": "client/FireClient/FireClient",
      "role": "iOS 壳层、UIApplication 入口与 ObjC++ 平台桥接",
      "modifiable": true,
      "project": "client/FireClient/FireClient.xcodeproj",
      "entrypoints": [
        "client/FireClient/FireClient/main.m",
        "client/FireClient/FireClient/FireClientAppDelegate.mm"
      ],
      "bridge_paths": [
        "client/FireClient/FireClient/iPhone",
        "client/FireClient/Application/platform/ios"
      ],
      "modification_policy": "first-party-editable",
      "availability": "tracked_required"
    },
    {
      "path": "engine",
      "role": "第一方 Nuclear 引擎源码",
      "modifiable": true,
      "build_impact": "engine -> 下游",
      "modification_policy": "first-party-editable",
      "availability": "tracked_required"
    },
    {
      "path": "cocos2d-x-3.0-oh",
      "role": "Win32 canonical Cocos2d-x 3.0-oh 基础层",
      "modifiable": true,
      "build_impact": "Cocos 3.0-oh -> engine -> FireClient -> MT3",
      "modification_policy": "first-party-high-risk",
      "encoding_note": "保持原编码，禁止批量转码",
      "availability": "tracked_required"
    },
    {
      "path": "cocos2d-x-2.2.6",
      "role": "Android/iOS Cocos2d-x 2.2.6 兼容基础层",
      "modifiable": true,
      "modification_policy": "first-party-high-risk",
      "encoding_note": "保持原编码，禁止批量转码",
      "availability": "tracked_required"
    },
    {
      "path": "dependencies",
      "role": "第三方 / vendor",
      "modifiable": false,
      "modification_policy": "vendor-read-only",
      "boundary": "不套用全仓统一风格",
      "availability": "tracked_required"
    },
    {
      "path": "server",
      "role": "Java 服务端、协议与生成链",
      "modifiable": true,
      "toolchain": "JDK 1.7/1.8 + Ant",
      "modification_policy": "first-party-editable",
      "availability": "tracked_required"
    },
    {
      "path": "tools",
      "role": "工具链、打包、编辑器与发布辅助",
      "modifiable": true,
      "validation": "按子项目现有工程验证",
      "modification_policy": "first-party-editable",
      "availability": "tracked_required"
    },
    {
      "path": "docs",
      "role": "项目文档",
      "modifiable": true,
      "rule": "先回源码和已验证命令，再回写文档",
      "modification_policy": "first-party-editable",
      "availability": "tracked_required"
    },
    {
      "path": ".codex",
      "role": "Codex 项目级运行配置与治理 sidecar",
      "modifiable": true,
      "validation": "validate/audit/quality_gate",